{
  "schema": "repository-harness-v0-release-artifacts/v1",
  "workflow": ".github/workflows/harness-cli-release.yml",
  "build_script": "scripts/build-harness-cli-release.sh",
  "platforms": [
    {"platform": "macos-arm64", "target": "aarch64-apple-darwin", "runner": "macos-15", "binary": "harness-cli-macos-arm64", "checksum": "harness-cli-macos-arm64.sha256"},
    {"platform": "macos-x64", "target": "x86_64-apple-darwin", "runner": "macos-15-intel", "binary": "harness-cli-macos-x64", "checksum": "harness-cli-macos-x64.sha256"},
    {"platform": "linux-x64", "target": "x86_64-unknown-linux-gnu", "runner": "ubuntu-24.04", "binary": "harness-cli-linux-x64", "checksum": "harness-cli-linux-x64.sha256"},
    {"platform": "linux-arm64", "target": "aarch64-unknown-linux-gnu", "runner": "ubuntu-24.04-arm", "binary": "harness-cli-linux-arm64", "checksum": "harness-cli-linux-arm64.sha256"},
    {"platform": "windows-x64", "target": "x86_64-pc-windows-msvc", "runner": "windows-latest", "binary": "harness-cli-windows-x64.exe", "checksum": "harness-cli-windows-x64.exe.sha256"}
  ]
}
